{
  "$schema": "http://json-schema.org/draft-07/schema#",
  "$id": "https://simpress.dev/sdk/0.1.0/scenario.schema.json",
  "title": "scenario",
  "type": "object",
  "properties": {
    "$schema": {
      "type": "string"
    },
    "name": {
      "type": "string",
      "minLength": 1
    },
    "seed": {
      "anyOf": [
        {
          "type": "integer",
          "minimum": 0
        },
        {
          "type": "string",
          "pattern": "^\\d{1,20}$"
        }
      ],
      "default": 42
    },
    "days": {
      "type": "integer",
      "minimum": 0,
      "maximum": 3650,
      "default": 1
    },
    "world": {
      "type": "string",
      "enum": [
        "demo",
        "empty"
      ],
      "default": "demo"
    },
    "expect": {
      "type": "object",
      "properties": {
        "hash": {
          "anyOf": [
            {
              "type": "string",
              "pattern": "^0x[0-9a-f]{16}$"
            },
            {
              "type": "string",
              "const": "replay"
            }
          ]
        },
        "day": {
          "type": "integer",
          "minimum": 0
        }
      },
      "additionalProperties": false,
      "default": {}
    },
    "content": {
      "type": "object",
      "properties": {
        "expect": {
          "type": "object",
          "properties": {
            "personas": {
              "type": "integer"
            },
            "happenings": {
              "type": "integer"
            },
            "prompt_layers": {
              "type": "integer"
            },
            "props": {
              "type": "integer"
            }
          },
          "additionalProperties": false
        }
      },
      "required": [
        "expect"
      ],
      "additionalProperties": false
    },
    "jobs": {
      "type": "array",
      "items": {
        "type": "object",
        "properties": {
          "kind": {
            "type": "string",
            "minLength": 1
          },
          "input": {},
          "revision": {
            "type": "integer",
            "minimum": 0,
            "default": 0
          },
          "llm": {
            "type": "array",
            "items": {
              "type": "string"
            },
            "default": []
          },
          "web": {
            "type": "object",
            "additionalProperties": {
              "type": "object",
              "properties": {
                "status": {
                  "type": "integer",
                  "minimum": 100,
                  "maximum": 599,
                  "default": 200
                },
                "headers": {
                  "type": "object",
                  "additionalProperties": {
                    "type": "string"
                  },
                  "default": {}
                },
                "body": {},
                "file": {
                  "type": "string",
                  "minLength": 1
                }
              },
              "additionalProperties": false
            },
            "default": {}
          },
          "expect": {
            "type": "object",
            "properties": {
              "digest": {
                "type": "object",
                "properties": {
                  "ok": {
                    "type": "boolean"
                  },
                  "score": {
                    "type": "integer",
                    "minimum": 0,
                    "maximum": 10
                  },
                  "words": {
                    "type": "integer",
                    "minimum": 0,
                    "maximum": 4294967295
                  },
                  "qa_defects": {
                    "type": "integer",
                    "minimum": 0,
                    "maximum": 65535
                  },
                  "artifact_sha": {
                    "type": "string",
                    "pattern": "^[0-9a-f]{64}$"
                  }
                },
                "additionalProperties": false
              },
              "artifactKind": {
                "type": "string"
              },
              "error": {
                "type": "string"
              }
            },
            "additionalProperties": false,
            "default": {}
          }
        },
        "required": [
          "kind"
        ],
        "additionalProperties": false
      },
      "default": []
    },
    "tools": {
      "type": "array",
      "items": {
        "type": "object",
        "properties": {
          "tool": {
            "type": "string",
            "minLength": 1
          },
          "input": {},
          "web": {
            "type": "object",
            "additionalProperties": {
              "type": "object",
              "properties": {
                "status": {
                  "type": "integer",
                  "minimum": 100,
                  "maximum": 599,
                  "default": 200
                },
                "headers": {
                  "type": "object",
                  "additionalProperties": {
                    "type": "string"
                  },
                  "default": {}
                },
                "body": {},
                "file": {
                  "type": "string",
                  "minLength": 1
                }
              },
              "additionalProperties": false
            },
            "default": {}
          },
          "expect": {
            "type": "object",
            "properties": {
              "output": {},
              "error": {
                "type": "string"
              }
            },
            "additionalProperties": false,
            "default": {}
          }
        },
        "required": [
          "tool"
        ],
        "additionalProperties": false
      },
      "default": []
    },
    "rules": {
      "type": "object",
      "properties": {
        "expect": {
          "type": "object",
          "properties": {
            "commands": {
              "anyOf": [
                {
                  "type": "array",
                  "items": {}
                },
                {
                  "type": "string",
                  "const": "replay"
                }
              ]
            },
            "count": {
              "type": "integer",
              "minimum": 0
            }
          },
          "additionalProperties": false
        }
      },
      "required": [
        "expect"
      ],
      "additionalProperties": false
    },
    "polls": {
      "type": "array",
      "items": {
        "type": "object",
        "properties": {
          "region": {
            "type": "string",
            "minLength": 1
          },
          "now": {
            "type": "string",
            "pattern": "^\\d{4}-\\d{2}-\\d{2}T\\d{2}:\\d{2}(:\\d{2}(\\.\\d+)?)?(Z|[+-]\\d{2}:\\d{2})$"
          },
          "cursor": {
            "type": [
              "string",
              "null"
            ],
            "default": null
          },
          "web": {
            "type": "object",
            "additionalProperties": {
              "type": "object",
              "properties": {
                "status": {
                  "type": "integer",
                  "minimum": 100,
                  "maximum": 599,
                  "default": 200
                },
                "headers": {
                  "type": "object",
                  "additionalProperties": {
                    "type": "string"
                  },
                  "default": {}
                },
                "body": {},
                "file": {
                  "type": "string",
                  "minLength": 1
                }
              },
              "additionalProperties": false
            },
            "default": {}
          },
          "expect": {
            "type": "object",
            "properties": {
              "facts": {
                "type": "integer",
                "minimum": 0
              },
              "happenings": {
                "type": "integer",
                "minimum": 0
              },
              "cursor": {
                "type": [
                  "string",
                  "null"
                ]
              },
              "factKinds": {
                "type": "array",
                "items": {
                  "type": "string"
                }
              },
              "error": {
                "type": "string"
              }
            },
            "additionalProperties": false,
            "default": {}
          }
        },
        "required": [
          "region",
          "now"
        ],
        "additionalProperties": false
      },
      "default": []
    },
    "publish": {
      "type": "object",
      "properties": {
        "credential": {
          "type": "object",
          "properties": {
            "ref": {
              "type": "string",
              "minLength": 1
            },
            "secret": {
              "type": "string",
              "minLength": 1
            }
          },
          "required": [
            "ref",
            "secret"
          ],
          "additionalProperties": false
        },
        "draft": {
          "type": "object",
          "properties": {
            "contentId": {
              "type": "string"
            },
            "path": {
              "type": "string"
            },
            "page": {},
            "message": {
              "type": "string"
            }
          },
          "required": [
            "contentId",
            "path",
            "message"
          ],
          "additionalProperties": false
        },
        "server": {
          "type": "array",
          "items": {
            "type": "object",
            "properties": {
              "method": {
                "type": "string",
                "enum": [
                  "GET",
                  "POST",
                  "PUT",
                  "PATCH",
                  "DELETE"
                ]
              },
              "url": {
                "type": "string",
                "format": "uri"
              },
              "expectHeaders": {
                "type": "object",
                "additionalProperties": {
                  "type": "string"
                },
                "default": {}
              },
              "expectBody": {},
              "status": {
                "type": "integer",
                "minimum": 100,
                "maximum": 599,
                "default": 200
              },
              "body": {}
            },
            "required": [
              "method",
              "url"
            ],
            "additionalProperties": false
          },
          "minItems": 1
        },
        "expect": {
          "type": "object",
          "properties": {
            "state": {
              "type": "string",
              "enum": [
                "open",
                "merged",
                "deployed",
                "failed"
              ]
            },
            "ref": {
              "type": "string"
            },
            "error": {
              "type": "string"
            }
          },
          "additionalProperties": false,
          "default": {}
        }
      },
      "required": [
        "credential",
        "draft",
        "server"
      ],
      "additionalProperties": false
    }
  },
  "required": [
    "name"
  ],
  "additionalProperties": false
}
